Raw Data,Cleaned Data
Cloudflare is unable to establish an SSL connection to the origin server.,cloudflare unable establish ssl connection origin server
"This site uses cookies to store information on your computer. Some are essential to make our site work; others help us improve the user experience. By using the site, you consent to the placement of these cookies. Read our privacy policy to learn more. AICPA & CIMA: As technology continues to evolve, it promotes changes to business models and surprises those who are unprepared. Businesses change their strategies and the way they operate. New threats and opportunities arise. In an increasingly data-driven world, CPAs need to be able to adapt to these technological disruptions. CPAs now often find themselves performing tasks that require skills in data analytics: In an effort to advance the use of analytics in auditing, the AICPA and Rutgers Business School in December 2015 announced a research initiative (raw.rutgers.edu/radar.html) focusing on integrating analytics into the audit process and on defining how analytics can be used to enhance audit quality. Potential improvements include producing higher-quality audit evidence, reducing repetitive tasks, and better correlating audit tasks to risks and assertions. The AICPA will use the findings from this initiative to inform guidance on audit data analytics for CPA firms of all sizes. A joint AICPA Assurance Services Executive Committee/Auditing Standards Board Task Force is developing a new Audit Data Analytics Guide, which will supersede the current Analytical Procedures guide. This new guide will carry forward much of the content included within the Analytical Procedures guide but will also include guidance on using audit data analytics throughout the audit process. Related projects are also underway to create voluntary audit data standards, which help with the extraction of data and facilitate the use of audit data analytics, and a tool to help illustrate where audit data analytics can be used in a typical audit program. Meanwhile, mastery of data analytics can help businesses generate a higher profit margin and gain a meaningful competitive advantage. Some experts even predict that companies ignoring data analytics may be forced out of business in the long run. As data analytics is an area where change may occur more quickly than companies or CPAs may adapt, change management concepts should be considered to take advantage of the opportunities data analytics can bring. Given that the price of computer hardware and cloud services has been ever-decreasing, what exactly stands in the way of companies being more data-driven? It is the human element. ""The human element of data analytics is the most critical factor in building a successful program,"" said Roshan Ramlukan, EY principal and global assurance analytics leader. ""But it's also the least understood and an impediment to further growth in this area. Leaders must also recognize that analytical skills must be developed in all of their people, not just a few data analysts."" (See the chart ""Importance of Analytics Skills"" for CFOs' ranking of the importance of data analytics skills for accounting and finance staff.) Importance of analytics skills Expertise in business analytics, such as business intelligence and data mining, was deemed mandatory for at least some accounting and finance employees by 61% of more than 2,100 CFOs participating in a 2014 survey by staffing resources firm Robert Half. Q: How important are business analytics skills, such as business intelligence, for your accounting and finance employees? Source: Robert Half survey. To better explain skill development in data analytics for CPAs, we first divide data analytics into four types as shown in the chart ""4 Types of Data Analytics."" Data analytics is often misunderstood as descriptive analysis (""what is"") only. The real value, however, lies in predictive (""what will be"") and prescriptive analysis (""What should we do?""). Data analytics is highly relevant as companies and industries transform to take advantage of technological innovations, and as expectations of regulators and investors with regard to data availability and analysis are increasing. Many accountants already use descriptive analytics in their daily work. They compute sums, averages, and percent changes to report sales results, customer credit risk, cost per customer, and availability of inventory. Accountants also are generally familiar with diagnostic analytics because they perform variance analyses and use analytic dashboards to explain historical results. This, however, is not sufficient. ""I work with many organizations, and I see that, unfortunately, the accounting function is probably one of the least analytical functions in large organizations,"" said Tom Davenport, Ph.D., a professor of information technology and management at Babson College in Babson Park, Mass. ""Clearly, it has a very strong transactional orientation, at best doing descriptive analytics focused only on structured small data. The various attempts to try to predict financial performance, getting into nonfinancial performance measures that might be good predictors of financial performance, have never really gone anywhere despite a lot of discussion over the years. This presents a great opportunity for accountants to provide a much more valuable role to management. Accounting not only has to catch up with analytics, but also needs to keep up with this rapidly changing field on an ongoing basis."" Predictive analytics and prescriptive analytics are now required because they provide actionable insights for companies. Accountants need to increase their competence in these areas to provide value to their organizations. Predictive analytics integrates data from various sources (such as enterprise resource planning, point-of-sale, and customer relationship management systems) to predict future outcomes based on statistical relationships found in historical data using regression-based modeling. One of the most common applications of predictive analytics is the computation of a credit score to indicate the likelihood of timely future credit payments. Prescriptive analytics uses a combination of sophisticated optimization techniques (self-optimizing algorithms) to suggest the most favorable courses of action to be taken. The analytics skills an accountant needs will differ depending on whether a professional will produce or consume information. Analytics production includes sourcing relevant data and performing analyses, which is more suitable for junior-level accountants. Analytics consumption is using the insights gained from analytics in decision-making and is more relevant for senior-level roles. Similar to a driver who doesn't know exactly how all the car's parts are working, CPAs do not need to become data scientists or computer engineers to benefit from the coming data revolution. It is most important that CPAs become more proficient consumers of analytics to both enhance their current audit practice with available technology as well as support their client base in undertaking data analytics activities. (See the chart ""How Skills Are Acquired"" for the methods organizations use to improve their employees' data analytics skills.) How skills are acquired In-house training is the most common method companies are using to improve employees' business analytics skills, according to a 2014 survey of more than 2,100 CFOs by staffing services firm Robert Half. Producing analytics starts with understanding the business objective (""What are the key questions that you expect the analysis to answer?"") and identifying and obtaining relevant internal and external data sources to support the analysis. Ramlukan said producing analytics often occurs at the junior level. He explained that the ideal ""analytically skilled"" employee has these three characteristics: As this ideal employee is a rare find, companies adapt by building teams of various specialties and technical skills. Production users need to have superior technical skills while consumption users should have a significant understanding of the business context. Both production and consumption users require an analytical mindset. ""We differentiate candidates who are experienced in data exploration, data visualization, and predictive modeling,"" said Brad Ames, CPA, internal audit director at Hewlett-Packard. These skill sets are not common among accounting firm personnel, Ames said, so when HP recruits for these positions, it posts job titles such as ""data scientist"" or ""analytics solution architect."" At the same time, accountants may lack the know-how about educational resources and best practices. A great way to get started on applying data analytics to the audit function is to improve one's knowledge of basic building blocks such as Excel and Access, and audit analytics tools such as ACL and IDEA. At larger accounting firms, analytics is used regularly in tax, auditing, consulting, and risk management. Ramlukan said data analytics is a skill that can be applied to many scenarios across all service lines. Employees who have this skill are therefore both very versatile and valuable to the organization. The work of CPAs will advance in the future to provide more data analysis, consulting, and decision-making support services. The audit function in particular will undergo a significant change with the incorporation of data analytics techniques. Data analytics can thus provide an important business opportunity for CPAs at accounting firms. CPAs at other organizations also are developing data analytics capabilities to support their needs. ""Over the years, I've leveraged data analytics tools for a variety of internal audit projects and continuous monitoring activities,"" said Joel White, CPA, CGMA, AICPA director—Internal Audit, Risk & Compliance. ""The tools' intuitive interface allows the user to quickly gain a grasp of large quantities of data and test 100% of various data attributes, as opposed to sampling a small percentage. Several examples of where I've used data analytics tools to analyze large data sets include corporate card transactions, payroll processing, vendor payments, health care charge capture, and customer/vendor deduping."" Data analytics tools have also been incorporated into continuous auditing/monitoring activities. HP uses data analytics technology to extract relevant transactional data and files from the database that holds accounting data and also extracts and performs analytics over unstructured data sourced externally. This information is provided to internal audit staff, external audit personnel, and business unit management to support oversight or operational activities. Given that most traditional degree-granting accounting programs do not require courses in statistics and data analysis, CPAs and accountants should seek additional training in these areas. (See the chart ""Learning Opportunities Ranked"" for a comparison of the educational value of different skill development methods.) Learning opportunities ranked When deciding on the most suitable path to data analytics education, we suggest considering the following options, which are ranked according to how employees could best approach data analytics, beginning with developing an initial understanding, developing an analytical mindset, and then acquiring specific data analytics skills. This graphic introduces these learning opportunities and ranks them by their potential for skill development. Ranking of 10 learning opportunities by potential for skill development 
In light of the changing nature of accounting practice, companies look for talent with a new set of skills. Ames said, ""The skill to deploy assurance technologies and utilize a variety of financial and nonfinancial data is highly valued."" A 2015 PwC report, Data Driven: What Students Need to Succeed in a Rapidly Changing Business World, cites the following examples for technical data analytics-related skills that accounting professionals should have or obtain: CHALLENGES AND OPPORTUNITIES The advent of data analytics offers both challenges and opportunities for CPAs. The challenges include undertaking appropriate training to develop the skills needed to initiate and support data analytics activities, as well as altering the present audit model to include appropriate audit analytics techniques. The opportunities include a technology-rich audit model that provides for greater thoroughness, efficiency, and accuracy, as well as new business opportunities to provide data analytics expertise to CPAs' clients and organizations. CPAs, whether working in public practice or industry, will enhance their career opportunities through the acquisition of additional data analytics expertise.  About the authors Norbert Tschakert (ntschakert@salemstate.edu) is an associate professor of accounting at Salem State University in Salem, Mass. Julia Kokina (jkokina@babson.edu) is an assistant professor of accounting at Babson College in Babson Park, Mass. Stephen Kozlowski (sp.kozlowski@rutgers.edu) recently graduated from the Ph.D. program in accounting at Rutgers University and will be an assistant professor of accounting at Eastern Illinois University in Charleston, Ill. Miklos Vasarhelyi (miklosv@andromeda.rutgers.edu) is a professor in the department of accounting and information systems at Rutgers Business School in Newark, N.J., and is a leader of the Rutgers AICPA Data Analytics Research Initiative. To comment on this article or to suggest an idea for another article, contact Ken Tysiac, editorial director, at ktysiac@aicpa.org or 919-402-2112. AICPA resources Articles CPE self-study For more information or to make a purchase, go to aicpastore.com or call the Institute at 888-777-7077. Websites  The Journal of Accountancy is now completely digital.        SPONSORED REPORT The new accounting standard provides greater transparency but requires wide-ranging data gathering. Learn more by downloading this comprehensive report. NEWS APP This quick guide walks you through the process of adding the Journal of Accountancy as a favorite news source in the News app from Apple. 
        ©  Association of International Certified Professional Accountants. All rights reserved. 
Reliable. Resourceful. Respected.",site us cooky store information computer essential make site work others help u improve user experience using site consent placement cooky read privacy policy learn aicpa cima technology continues evolve promotes change business model surprise unprepared business change strategy way operate new threat opportunity arise increasingly data driven world cpa need able adapt technological disruption cpa often find performing task require skill data analytics effort advance use analytics auditing aicpa rutgers business school december 2015 announced research initiative raw rutgers edu radar html focusing integrating analytics audit process defining analytics used enhance audit quality potential improvement include producing higher quality audit evidence reducing repetitive task better correlating audit task risk assertion aicpa use finding initiative inform guidance audit data analytics cpa firm size joint aicpa assurance service executive committee auditing standard board task force developing new audit data analytics guide supersede current analytical procedure guide new guide carry forward much content included within analytical procedure guide also include guidance using audit data analytics throughout audit process related project also underway create voluntary audit data standard help extraction data facilitate use audit data analytics tool help illustrate audit data analytics used typical audit program meanwhile mastery data analytics help business generate higher profit margin gain meaningful competitive advantage expert even predict company ignoring data analytics may forced business long run data analytics area change may occur quickly company cpa may adapt change management concept considered take advantage opportunity data analytics bring given price computer hardware cloud service ha ever decreasing exactly stand way company data driven human element human element data analytics critical factor building successful program said roshan ramlukan ey principal global assurance analytics leader also least understood impediment growth area leader must also recognize analytical skill must developed people data analyst see chart importance analytics skill cfo ranking importance data analytics skill accounting finance staff importance analytics skill expertise business analytics business intelligence data mining wa deemed mandatory least accounting finance employee 61 2 100 cfo participating 2014 survey staffing resource firm robert half q important business analytics skill business intelligence accounting finance employee source robert half survey better explain skill development data analytics cpa first divide data analytics four type shown chart 4 type data analytics data analytics often misunderstood descriptive analysis real value however lie predictive prescriptive analysis data analytics highly relevant company industry transform take advantage technological innovation expectation regulator investor regard data availability analysis increasing many accountant already use descriptive analytics daily work compute sum average percent change report sale result customer credit risk cost per customer availability inventory accountant also generally familiar diagnostic analytics perform variance analysis use analytic dashboard explain historical result however sufficient work many organization see unfortunately accounting function probably one least analytical function large organization said tom davenport ph professor information technology management babson college babson park mass clearly ha strong transactional orientation best descriptive analytics focused structured small data various attempt try predict financial performance getting nonfinancial performance measure might good predictor financial performance never really gone anywhere despite lot discussion year present great opportunity accountant provide much valuable role management accounting ha catch analytics also need keep rapidly changing field ongoing basis predictive analytics prescriptive analytics required provide actionable insight company accountant need increase competence area provide value organization predictive analytics integrates data various source enterprise resource planning point sale customer relationship management system predict future outcome based statistical relationship found historical data using regression based modeling one common application predictive analytics computation credit score indicate likelihood timely future credit payment prescriptive analytics us combination sophisticated optimization technique self optimizing algorithm suggest favorable course action taken analytics skill accountant need differ depending whether professional produce consume information analytics production includes sourcing relevant data performing analysis suitable junior level accountant analytics consumption using insight gained analytics decision making relevant senior level role similar driver know exactly car part working cpa need become data scientist computer engineer benefit coming data revolution important cpa become proficient consumer analytics enhance current audit practice available technology well support client base undertaking data analytics activity see chart skill acquired method organization use improve employee data analytics skill skill acquired house training common method company using improve employee business analytics skill according 2014 survey 2 100 cfo staffing service firm robert half producing analytics start understanding business objective key question expect analysis answer identifying obtaining relevant internal external data source support analysis ramlukan said producing analytics often occurs junior level explained ideal analytically skilled employee ha three characteristic ideal employee rare find company adapt building team various specialty technical skill production user need superior technical skill consumption user significant understanding business context production consumption user require analytical mindset differentiate candidate experienced data exploration data visualization predictive modeling said brad ames cpa internal audit director hewlett packard skill set common among accounting firm personnel ames said hp recruit position post job title data scientist analytics solution architect time accountant may lack know educational resource best practice great way get started applying data analytics audit function improve one knowledge basic building block excel access audit analytics tool acl idea larger accounting firm analytics used regularly tax auditing consulting risk management ramlukan said data analytics skill applied many scenario across service line employee skill therefore versatile valuable organization work cpa advance future provide data analysis consulting decision making support service audit function particular undergo significant change incorporation data analytics technique data analytics thus provide important business opportunity cpa accounting firm cpa organization also developing data analytics capability support need year leveraged data analytics tool variety internal audit project continuous monitoring activity said joel white cpa cgma aicpa director internal audit risk compliance tool intuitive interface allows user quickly gain grasp large quantity data test 100 various data attribute opposed sampling small percentage several example used data analytics tool analyze large data set include corporate card transaction payroll processing vendor payment health care charge capture customer vendor deduping data analytics tool also incorporated continuous auditing monitoring activity hp us data analytics technology extract relevant transactional data file database hold accounting data also extract performs analytics unstructured data sourced externally information provided internal audit staff external audit personnel business unit management support oversight operational activity given traditional degree granting accounting program require course statistic data analysis cpa accountant seek additional training area see chart learning opportunity ranked comparison educational value different skill development method learning opportunity ranked deciding suitable path data analytics education suggest considering following option ranked according employee could best approach data analytics beginning developing initial understanding developing analytical mindset acquiring specific data analytics skill graphic introduces learning opportunity rank potential skill development ranking 10 learning opportunity potential skill development light changing nature accounting practice company look talent new set skill ames said skill deploy assurance technology utilize variety financial nonfinancial data highly valued 2015 pwc report data driven student need succeed rapidly changing business world cite following example technical data analytics related skill accounting professional obtain challenge opportunity advent data analytics offer challenge opportunity cpa challenge include undertaking appropriate training develop skill needed initiate support data analytics activity well altering present audit model include appropriate audit analytics technique opportunity include technology rich audit model provides greater thoroughness efficiency accuracy well new business opportunity provide data analytics expertise cpa client organization cpa whether working public practice industry enhance career opportunity acquisition additional data analytics expertise author norbert tschakert ntschakert salemstate edu associate professor accounting salem state university salem mass julia kokina jkokina babson edu assistant professor accounting babson college babson park mass stephen kozlowski sp kozlowski rutgers edu recently graduated ph program accounting rutgers university assistant professor accounting eastern illinois university charleston ill miklos vasarhelyi miklosv andromeda rutgers edu professor department accounting information system rutgers business school newark j leader rutgers aicpa data analytics research initiative comment article suggest idea another article contact ken tysiac editorial director ktysiac aicpa org 919 402 2112 aicpa resource article cpe self study information make purchase go aicpastore com call institute 888 777 7077 website journal accountancy completely digital sponsored report new accounting standard provides greater transparency requires wide ranging data gathering learn downloading comprehensive report news app quick guide walk process adding journal accountancy favorite news source news app apple association international certified professional accountant right reserved reliable resourceful respected
"
		The leading site for news and procurement in the retail industry 
				Powered by
				
 © Verdict Media Limited 2023",leading site news procurement retail industry powered verdict medium limited 2023
