Raw Data,Cleaned Data
"Today, businesses can collect data along every point of the customer journey. This information might include mobile app usage, digital clicks, interactions on social media and more, all contributing to a data fingerprint that is completely unique to its owner. However, at some point not too long ago, the thought of customers sharing information such as what time they woke up, what they ate for breakfast, or where they went on holiday, would have been a bizarre consideration to say the least. Customer social norms have certainly changed and as a result, expectations have escalated. This blog will outline five examples of benefits that businesses can reap from data and analytics in terms of driving positive outcomes for their own business and their customers, while still maintaining and facilitating the highest level of data protection. Organisations are increasingly under competitive pressure to not only acquire customers but also understand their customers’ needs to be able to optimise customer experience and develop longstanding relationships. By sharing their data and allowing relaxed privacy in its use, customers expect companies to know them, form relevant interactions, and provide a seamless experience across all touch points. Thus, companies need to capture and reconcile multiple customer identifiers such as cell phone, email and address, to one single customer ID. Customers are increasingly using multiple channels in their interactions with companies, hence both traditional and digital data sources must be brought together to understand customers’ behaviours. Additionally, customers expect and companies need to deliver contextually relevant, real-time experiences. Security and fraud analytics aims to protect all physical, financial and intellectual assets from misuse by internal and external threats. Efficient data and analytics capabilities will deliver optimum levels of fraud prevention and overall organisational security: deterrence requires mechanisms that allow companies to quickly detect potentially fraudulent activity and anticipate future activity, as well as identifying and tracking perpetrators. Use of statistical, network, path, and big data methodologies for predictive fraud propensity models leading to alerts will ensure timely responses triggered by real-time threat detection processes and automated alerts and mitigation. Data management alongside efficient and transparent reporting of fraud incidents will result in improved fraud risk management processes. Furthermore, integration and correlation of data across the enterprise can offer for a unified view of the fraud across various lines of business, products, and transactions.  Multi-genre analytics and data foundation provide more accurate fraud trend analyses, forecasts, and anticipation of potential future modus operandi and identification of vulnerabilities in fraud audits and investigations. Products are the life-blood of any organisation and often the largest investment companies make. The product management team’s role is to recognise trends that drive strategic roadmap for innovation, new features, and services. Effective data collation from 3rd party sources where individuals publicise their thoughts and opinions, combined with analytics will help companies stay competitive when demand changes or new technology is developed as well as facilitate anticipation of what the market demands to provide the product before it is requested. Companies are still struggling with structured data, and need to be extremely responsive to cope with the volatility created by customers engaging via digital technologies today. Being able to react in real time and make the customer feel personally valued is only possible through advanced analytics. Big data offers the opportunity for interactions to be based on the personality of the customer, by understanding their attitudes and considering factors such as real-time location to help deliver personalisation in a multi-channel service environment.  Poor management of operations can and will lead to a myriad of costly issues, including a significant risk of damaging the customer experience, and ultimately brand loyalty. Applying analytics for designing, controlling the process and optimizing business operations in the production of goods or services ensures efficiency and effectiveness to fulfil customer expectations and achieve operational excellence. Advanced analytical techniques can be deployed to improve field operations productivity and efficiency as well as optimize an organisational workforce according to business needs and customer demand. Optimum utilisation of data and analytics will also ensure that continuous improvements are instigated on an on-going basis as a result of end-to-end view and measurement of key operational metrics. For example, many organisations, inventory is the largest item in the current assets category - too much or not enough inventory can directly affect a company’s direct costs and profitability. Data and analytics can support inventory management by providing uninterrupted production, sales, and/or customer-service levels at minimum cost. The use of data and analytics can provide transparency into current and planned inventory positions as well as deliver insight into drivers of height, composition and location of stock and aid the determination of inventory strategy and decision making. Customers expect a relevant, seamless experience and for companies to know them wherever they engage. A strategist and change leader, Yasmeen Ahmad has worked on executive teams with focus on defining and leading strategy, driving priorities with a sense of urgency and leading cross-functional initiatives. Yasmeen has held roles including VP of Enterprise Analytics, Head of Global Communications and Chief of Staff to a CEO. Her creativity, ideas and execution have supported organizations to move quickly to deliver on key transformation objectives, including pivots to analytics, as-a-service, subscription and cloud. 
 
Yasmeen is a strong communicator, well versed in connecting business and technical disciplines. Her keynote presentations, articles and published materials are demonstration of her thought leadership and ability to simplify complex concepts. She is regarded as an expert in the enterprise data and analytics domain, having successfully consulted to deliver multi-million dollars of value within Fortune 500 companies. Yasmeen leads with a passion for being customer obsessed and outcome focused. A strong people leader, Yasmeen has driven change management and people initiatives to foster a culture of growth and continuous improvement. Yasmeen is a strong proponent for transparency, diversity, inclusiveness and authentic leadership. 
 
Yasmeen has a PhD in Life Sciences from the Wellcome Trust Centre in Gene Regulation and Expression and has studied on executive programs related to Disruptive Innovative and Strategic IQ at Harvard Business School. Yasmeen has been named as one of the top 50 data leaders and influencers by Information Age and Data Scientist of the Year by Computing magazine, as well as being nominated as a Finalist for Innovator of the Year in the Women in IT Awards. Finally, Yasmeen is part of the exclusive Executive Development Program at Teradata.
  
                        Subscribe to Teradata’s blog to get weekly insights delivered to you
                     I consent that Teradata Corporation, as provider of this website, may occasionally send me Teradata Marketing Communications emails with information regarding products, data analytics, and event and webinar invitations. I understand that I may unsubscribe at any time by following the unsubscribe link at the bottom of any email I receive. Your privacy is important. Your personal information will be collected, stored, and processed in accordance with the Teradata Global Privacy Policy. You're officially subscribed to the Teradata Blog. Check your inbox each week for our take on data science, business analytics, tech trends, and more.",today business collect data along every point customer journey information might include mobile app usage digital click interaction social medium contributing data fingerprint completely unique owner however point long ago thought customer sharing information time woke ate breakfast went holiday would bizarre consideration say least customer social norm certainly changed result expectation escalated blog outline five example benefit business reap data analytics term driving positive outcome business customer still maintaining facilitating highest level data protection organisation increasingly competitive pressure acquire customer also understand customer need able optimise customer experience develop longstanding relationship sharing data allowing relaxed privacy use customer expect company know form relevant interaction provide seamless experience across touch point thus company need capture reconcile multiple customer identifier cell phone email address one single customer id customer increasingly using multiple channel interaction company hence traditional digital data source must brought together understand customer behaviour additionally customer expect company need deliver contextually relevant real time experience security fraud analytics aim protect physical financial intellectual asset misuse internal external threat efficient data analytics capability deliver optimum level fraud prevention overall organisational security deterrence requires mechanism allow company quickly detect potentially fraudulent activity anticipate future activity well identifying tracking perpetrator use statistical network path big data methodology predictive fraud propensity model leading alert ensure timely response triggered real time threat detection process automated alert mitigation data management alongside efficient transparent reporting fraud incident result improved fraud risk management process furthermore integration correlation data across enterprise offer unified view fraud across various line business product transaction multi genre analytics data foundation provide accurate fraud trend analysis forecast anticipation potential future modus operandi identification vulnerability fraud audit investigation product life blood organisation often largest investment company make product management team role recognise trend drive strategic roadmap innovation new feature service effective data collation 3rd party source individual publicise thought opinion combined analytics help company stay competitive demand change new technology developed well facilitate anticipation market demand provide product requested company still struggling structured data need extremely responsive cope volatility created customer engaging via digital technology today able react real time make customer feel personally valued possible advanced analytics big data offer opportunity interaction based personality customer understanding attitude considering factor real time location help deliver personalisation multi channel service environment poor management operation lead myriad costly issue including significant risk damaging customer experience ultimately brand loyalty applying analytics designing controlling process optimizing business operation production good service ensures efficiency effectiveness fulfil customer expectation achieve operational excellence advanced analytical technique deployed improve field operation productivity efficiency well optimize organisational workforce according business need customer demand optimum utilisation data analytics also ensure continuous improvement instigated going basis result end end view measurement key operational metric example many organisation inventory largest item current asset category much enough inventory directly affect company direct cost profitability data analytics support inventory management providing uninterrupted production sale customer service level minimum cost use data analytics provide transparency current planned inventory position well deliver insight driver height composition location stock aid determination inventory strategy decision making customer expect relevant seamless experience company know wherever engage strategist change leader yasmeen ahmad ha worked executive team focus defining leading strategy driving priority sense urgency leading cross functional initiative yasmeen ha held role including vp enterprise analytics head global communication chief staff ceo creativity idea execution supported organization move quickly deliver key transformation objective including pivot analytics service subscription cloud yasmeen strong communicator well versed connecting business technical discipline keynote presentation article published material demonstration thought leadership ability simplify complex concept regarded expert enterprise data analytics domain successfully consulted deliver multi million dollar value within fortune 500 company yasmeen lead passion customer obsessed outcome focused strong people leader yasmeen ha driven change management people initiative foster culture growth continuous improvement yasmeen strong proponent transparency diversity inclusiveness authentic leadership yasmeen ha phd life science wellcome trust centre gene regulation expression ha studied executive program related disruptive innovative strategic iq harvard business school yasmeen ha named one top 50 data leader influencers information age data scientist year computing magazine well nominated finalist innovator year woman award finally yasmeen part exclusive executive development program teradata subscribe teradata blog get weekly insight delivered consent teradata corporation provider website may occasionally send teradata marketing communication email information regarding product data analytics event webinar invitation understand may unsubscribe time following unsubscribe link bottom email receive privacy important personal information collected stored processed accordance teradata global privacy policy officially subscribed teradata blog check inbox week take data science business analytics tech trend
"View all results Data analysis, data analytics. Two terms for the same concept? Or different, but related, terms? It’s a common misconception that data analysis and data analytics are the same thing. The generally accepted distinction is: To explain this confusion—and attempt to clear it up—we’ll look at both terms, examples, and tools. 

 Data analytics is a broad term that defines the concept and practice (or, perhaps science and art) of all activities related to data. The primary goal is for data experts, including data scientists, engineers, and analysts, to make it easy for the rest of the business to access and understand these findings. Data that sits raw, as-is, has no value. Instead, it’s what you do with that data that provides value. Data analytics includes all the steps you take, both human- and machine-enabled, to discover, interpret, visualize, and tell the story of patterns in your data in order to drive business strategy and outcomes. A successful data analytics practice can—should—provide a better strategy for where your business can go. When done well, data analytics can help you: Like any true practice, data analytics is systematic, consisting of many computational and management steps. Experts stress the word “systematic”. Being systematic is vital because data analytics uses many different activities and draws on all types and sizes of data sources. Many subject areas comprise data analytics, including data science, machine learning, and applied statistics. One tangible result of a data analytics practice is likely well-planned reports that use data visualization to tell the story of the most salient points so that the rest of the business—who aren’t data experts—can understand, develop, and adapt their strategies. Think of the many ways data analytics can highlight areas of opportunity for your business: The data analytics practice encompasses many separate processes, which can comprise a data pipeline: 

 Consider data analysis one slice of the data analytics pie. Data analysis consists of cleaning, transforming, modeling, and questioning data to find useful information. (It’s generally agreed that other slices are other activities, from collection to storage to visualization.) The act of data analysis is usually limited to a single, already prepared dataset. You’ll inspect, arrange, and question the data. Today, in the 2020s, a software or “machine” usually does a first round of analysis, often directly in one of your databases or tools. But this is augmented by a human who investigates and interrogates the data with more context. When you’re done analyzing a dataset, you’ll turn to other data analytics activities to: A vital point of data analysis is that the analysis already captures data, meaning data from the past. There are many types of data analysis techniques. Here are the most well-known: Combine these different methods depending on the business need and decision-making process. Pieter Van Iperen, Managing Partner of PWV Consultants, uses the example of web traffic, which your company very likely tracks. You have tools in place to automatically collect and measure individual metrics within web traffic, such as: Each of those data points is a small part of the overall analysis. Then, humans perform further analysis to determine things like how to optimize your website to: Analysis that is repeatable can often be converted into a new metric within your analytic platform. Brack Nelson, Marketing Manager at Incrementors SEO Services, suggests that the outcome of data analytics is more encompassing and beneficial than the output of data analysis alone. Consider the differences between: The ultimate move, Brack says, is creating a product that makes a data-driven prediction and contacts another system’s API is order to produce action—that’s data analytics in action. Analytics software are tools that help humans and machines perform the analysis that allows us to make mission-critical business decisions. Common tools for performing data analysis and overall analytics include: (Check out BMC Guides for tutorials on many big data and data visualization tools.) Interestingly, the terms are sometimes confused by data scientists and data analysts themselves! Polling a variety of people in the wide world of data revealed this divide. Most agreed that data analytics is the broader field, of which data analysis is one key function, but others had different takes. This lack of clarity underscores that maybe the question isn’t data analytics versus data analysis—but whether you’re doing both as well as you can. Several people said that they aren’t concerned if us non-data experts use the terms interchangeably. So, if you confuse data analytics with analysis at your next meeting, most folks will be none the wiser. Every business and organization can take advantage of vast volumes and variety of data to make well informed strategic decisions — that’s where metrics come in. This e-book introduces metrics in enterprise IT. Organizations of all shapes and sizes can use any number of metrics. In this e-book, we’ll look at four areas where metrics are vital to enterprise IT. These postings are my own and do not necessarily represent BMC's position, strategies, or opinion. See an error or have a suggestion? Please let us know by emailing blogs@bmc.com. BMC works with 86% of the Forbes Global 50 and customers and partners around the world to create their future. With our history of innovation, industry-leading automation, operations, and service management solutions, combined with unmatched flexibility, we help organizations free up time and space to become an Autonomous Digital Enterprise that conquers the opportunities ahead. Learn more about BMC › Chrissy Kidd is a writer and editor who makes sense of theories and new developments in technology. Formerly the managing editor of BMC Blogs, you can reach her on LinkedIn or at chrissykidd.com. Rachel Hornay is a content strategist living in colorful Colorado. Rachel graduated with an MFA from Savannah College of Art and Design. She brings years of experience, working with a diverse portfolio of clients in technology and beyond, crafting content, connecting to everyone.       Contact Free Trials Legal Privacy Policy Update my preferences Trust Center  ©Copyright 2005-2023 BMC Software, Inc. Use of this site signifies your acceptance of BMC’s Terms of Use. BMC, the BMC logo, and other BMC marks are assets of BMC Software, Inc. These trademarks are registered  and may be registered in the U.S. and in other countries.    ",view result data analysis data analytics two term concept different related term common misconception data analysis data analytics thing generally accepted distinction explain confusion attempt clear look term example tool data analytics broad term defines concept practice perhaps science art activity related data primary goal data expert including data scientist engineer analyst make easy rest business access understand finding data sits raw ha value instead data provides value data analytics includes step take human machine enabled discover interpret visualize tell story pattern data order drive business strategy outcome successful data analytics practice provide better strategy business go done well data analytics help like true practice data analytics systematic consisting many computational management step expert stress word systematic systematic vital data analytics us many different activity draw type size data source many subject area comprise data analytics including data science machine learning applied statistic one tangible result data analytics practice likely well planned report use data visualization tell story salient point rest business data expert understand develop adapt strategy think many way data analytics highlight area opportunity business data analytics practice encompasses many separate process comprise data pipeline consider data analysis one slice data analytics pie data analysis consists cleaning transforming modeling questioning data find useful information generally agreed slice activity collection storage visualization act data analysis usually limited single already prepared dataset inspect arrange question data today 2020s software machine usually doe first round analysis often directly one database tool augmented human investigates interrogates data context done analyzing dataset turn data analytics activity vital point data analysis analysis already capture data meaning data past many type data analysis technique well known combine different method depending business need decision making process pieter van iperen managing partner pwv consultant us example web traffic company likely track tool place automatically collect measure individual metric within web traffic data point small part overall analysis human perform analysis determine thing like optimize website analysis repeatable often converted new metric within analytic platform brack nelson marketing manager incrementors seo service suggests outcome data analytics encompassing beneficial output data analysis alone consider difference ultimate move brack say creating product make data driven prediction contact another system api order produce action data analytics action analytics software tool help human machine perform analysis allows u make mission critical business decision common tool performing data analysis overall analytics include check bmc guide tutorial many big data data visualization tool interestingly term sometimes confused data scientist data analyst polling variety people wide world data revealed divide agreed data analytics broader field data analysis one key function others different take lack clarity underscore maybe question data analytics versus data analysis whether well several people said concerned u non data expert use term interchangeably confuse data analytics analysis next meeting folk none wiser every business organization take advantage vast volume variety data make well informed strategic decision metric come book introduces metric enterprise organization shape size use number metric book look four area metric vital enterprise posting necessarily represent bmc position strategy opinion see error suggestion please let u know emailing blog bmc com bmc work 86 forbes global 50 customer partner around world create future history innovation industry leading automation operation service management solution combined unmatched flexibility help organization free time space become autonomous digital enterprise conquers opportunity ahead learn bmc chrissy kidd writer editor make sense theory new development technology formerly managing editor bmc blog reach linkedin chrissykidd com rachel hornay content strategist living colorful colorado rachel graduated mfa savannah college art design brings year experience working diverse portfolio client technology beyond crafting content connecting everyone contact free trial legal privacy policy update preference trust center copyright 2005 2023 bmc software inc use site signifies acceptance bmc term use bmc bmc logo bmc mark asset bmc software inc trademark registered may registered country
