Raw Data,Cleaned Data
"Pete Rathburn is a copy editor and fact-checker with expertise in economics and personal finance and over twenty years of experience in the classroom. Investopedia / Joules Garcia 
Data analytics is the science of analyzing raw data to make conclusions about that information. Many of the techniques and processes of data analytics have been automated into mechanical processes and algorithms that work over raw data for human consumption.
  
Data analytics is a broad term that encompasses many diverse types of data analysis. Any type of information can be subjected to data analytics techniques to get insight that can be used to improve things. Data analytics techniques can reveal trends and metrics that would otherwise be lost in the mass of information. This information can then be used to optimize processes to increase the overall efficiency of a business or system.
 
For example, manufacturing companies often record the runtime, downtime, and work queue for various machines and then analyze the data to better plan the workloads so the machines operate closer to peak capacity.
 
Data analytics can do much more than point out bottlenecks in production. Gaming companies use data analytics to set reward schedules for players that keep the majority of players active in the game. Content companies use many of the same data analytics to keep you clicking, watching, or re-organizing content to get another view or another click.
 
Data analytics is important because it helps businesses optimize their performances. Implementing it into the business model means companies can help reduce costs by identifying more efficient ways of doing business and by storing large amounts of data. A company can also use data analytics to make better business decisions and help analyze customer trends and satisfaction, which can lead to new—and better—products and services. 
 Some of the early days of modern data analytics are due to SQL. Created in 1979, this computing language allows relational databases to be queried and resulting data sets to be more easily analyzed. SQL is still widely used today. 
The process involved in data analysis involves several different steps:
 
Data analytics is broken down into four basic types.
 
Data analytics underpins many quality control systems in the financial world, including the ever-popular Six Sigma program. If you aren’t properly measuring something—whether it's your weight or the number of defects per million in a production line—it is nearly impossible to optimize it.
 
Some of the sectors that have adopted the use of data analytics include the travel and hospitality industry, where turnarounds can be quick. This industry can collect customer data and figure out where the problems, if any, lie and how to fix them.
 
Healthcare combines the use of high volumes of structured and unstructured data and uses data analytics to make quick decisions. Similarly, the retail industry uses copious amounts of data to meet the ever-changing demands of shoppers. The information retailers collect and analyze can help them identify trends, recommend products, and increase profits. 
 As of December 2021, the average total for a data analyst in the United States was just over $93,000. 
There are several different analytical methods and techniques data analysts can use to process data and extract information. Some of the most popular methods are listed below.
 
In addition to a broad range of mathematical and statistical approaches to crunching numbers, data analytics has rapidly evolved in technological capabilities. Today, data analysts have a broad range of software tools to help acquire data, store information, process data, and report findings.
 
Data analytics has always had loose ties to spreadsheets and Microsoft Excel. Now, data analysts also often interact with raw programming languages to transform and manipulate databases. Open-source languages such as Python are often utilized. More specific tools for data analytics like R can be used for statistical analysis or graphical modeling.
 
Data analysts also have help when reporting or communicating findings. Both Tableau and Power BI are data visualization and analysis tools to compile information, perform data analytics, and distribute results via dashboards and reports.
 
Other tools are also emerging to assist data analysts. SAS is an analytics platform that can assist with data mining, while Apache Spark is an open-source platform useful for processing large sets of data. Data analysts now have a broad range of technological capabilities to further enhance the value they deliver to their company.
 Data analytics is important because it helps businesses optimize their performances. Implementing it into the business model means companies can help reduce costs by identifying more efficient ways of doing business. A company can also use data analytics to make better business decisions and help analyze customer trends and satisfaction, which can lead to new—and better—products and services.  Data analytics is broken down into four basic types. Descriptive analytics describes what has happened over a given period. Diagnostic analytics focuses more on why something happened. Predictive analytics moves to what is likely going to happen in the near term. Finally, prescriptive analytics suggests a course of action. Data analytics has been adopted by several sectors, such as the travel and hospitality industry, where turnarounds can be quick. This industry can collect customer data and figure out where the problems, if any, lie and how to fix them. Healthcare is another sector that combines the use of high volumes of structured and unstructured data and data analytics can help in making quick decisions. Similarly, the retail industry uses copious amounts of data to meet the ever-changing demands of shoppers. 
In a world increasingly becoming reliant on information and gathering statistics, data analytics helps individuals and organizations make sure of their data. Using a variety of tools and techniques, a set of raw numbers can be transformed into informative, educational insights that drive decision-making and thoughtful management.
 Oracle. ""Database SQL Reference."" Glassdoor. ""Data Analyst Salaries."" 
FinTech 
Degrees & Certifications 
Accounting 
Products and Services 
Trading Platforms & Tools 
Technical Analysis",pete rathburn copy editor fact checker expertise economics personal finance twenty year experience classroom investopedia joule garcia data analytics science analyzing raw data make conclusion information many technique process data analytics automated mechanical process algorithm work raw data human consumption data analytics broad term encompasses many diverse type data analysis type information subjected data analytics technique get insight used improve thing data analytics technique reveal trend metric would otherwise lost mass information information used optimize process increase overall efficiency business system example manufacturing company often record runtime downtime work queue various machine analyze data better plan workload machine operate closer peak capacity data analytics much point bottleneck production gaming company use data analytics set reward schedule player keep majority player active game content company use many data analytics keep clicking watching organizing content get another view another click data analytics important help business optimize performance implementing business model mean company help reduce cost identifying efficient way business storing large amount data company also use data analytics make better business decision help analyze customer trend satisfaction lead new better product service early day modern data analytics due sql created 1979 computing language allows relational database queried resulting data set easily analyzed sql still widely used today process involved data analysis involves several different step data analytics broken four basic type data analytics underpins many quality control system financial world including ever popular six sigma program properly measuring something whether weight number defect per million production line nearly impossible optimize sector adopted use data analytics include travel hospitality industry turnaround quick industry collect customer data figure problem lie fix healthcare combine use high volume structured unstructured data us data analytics make quick decision similarly retail industry us copious amount data meet ever changing demand shopper information retailer collect analyze help identify trend recommend product increase profit december 2021 average total data analyst united state wa 93 000 several different analytical method technique data analyst use process data extract information popular method listed addition broad range mathematical statistical approach crunching number data analytics ha rapidly evolved technological capability today data analyst broad range software tool help acquire data store information process data report finding data analytics ha always loose tie spreadsheet microsoft excel data analyst also often interact raw programming language transform manipulate database open source language python often utilized specific tool data analytics like used statistical analysis graphical modeling data analyst also help reporting communicating finding tableau power bi data visualization analysis tool compile information perform data analytics distribute result via dashboard report tool also emerging assist data analyst sa analytics platform assist data mining apache spark open source platform useful processing large set data data analyst broad range technological capability enhance value deliver company data analytics important help business optimize performance implementing business model mean company help reduce cost identifying efficient way business company also use data analytics make better business decision help analyze customer trend satisfaction lead new better product service data analytics broken four basic type descriptive analytics describes ha happened given period diagnostic analytics focus something happened predictive analytics move likely going happen near term finally prescriptive analytics suggests course action data analytics ha adopted several sector travel hospitality industry turnaround quick industry collect customer data figure problem lie fix healthcare another sector combine use high volume structured unstructured data data analytics help making quick decision similarly retail industry us copious amount data meet ever changing demand shopper world increasingly becoming reliant information gathering statistic data analytics help individual organization make sure data using variety tool technique set raw number transformed informative educational insight drive decision making thoughtful management oracle database sql reference glassdoor data analyst salary fintech degree certification accounting product service trading platform tool technical analysis
"We have updated our Privacy Policy to better reflect how we collect, use and share your information. Home / Learning / What is Data Analytics? As the process of analyzing raw data to find trends and answer questions, the definition of data analytics captures its broad scope of the field. However, it includes many techniques with many different goals. The data analytics process has some components that can help a variety of initiatives. By combining these components, a successful data analytics initiative will provide a clear picture of where you are, where you have been and where you should go. 
Gain in-demand analytics skills with an online master’s in business analytics. Complete in as few as 12 months.
 Gain in-demand analytics skills with an online master’s in business analytics. Complete in as few as 12 months.   info  SPONSORED  Data analytics is a broad field. There are four primary types of data analytics: descriptive, diagnostic, predictive and prescriptive analytics. Each type has a different goal and a different place in the data analysis process. These are also the primary data analytics applications in business. These types of data analytics provide the insight that businesses need to make effective and efficient decisions. Used in combination they provide a well-rounded understanding of a company’s needs and opportunities. Data analysts exist at the intersection of information technology, statistics and business. They combine these fields in order to help businesses and organizations succeed. The primary goal of a data analyst is to increase efficiency and improve performance by discovering patterns in data. Thinking about a graduate degree in data analytics? Start with a sponsored online analytics program: 
Gain in-demand analytics skills with an online master’s in business analytics. Complete in as few as 12 months.
 Gain in-demand analytics skills with an online master’s in business analytics. Complete in as few as 12 months.   info  SPONSORED  The work of a data analyst involves working with data throughout the data analysis pipeline. This means working with data in various ways. The primary steps in the data analytics process are data mining, data management, statistical analysis, and data presentation. The importance and balance of these steps depend on the data being used and the goal of the analysis. Data mining is an essential process for many data analytics tasks. This involves extracting data from unstructured data sources. These may include written text, large complex databases, or raw sensor data. The key steps in this process are to extract, transform, and load data (often called ETL.) These steps convert raw data into a useful and manageable format. This prepares data for storage and analysis. Data mining is generally the most time-intensive step in the data analysis pipeline. Data management or data warehousing is another key aspect of a data analyst’s job. Data warehousing involves designing and implementing databases that allow easy access to the results of data mining. This step generally involves creating and managing SQL databases. Non-relational and NoSQL databases are becoming more common as well. Statistical analysis allows analysts to create insights from data. Both statistics and machine learning techniques are used to analyze data. Big data is used to create statistical models that reveal trends in data. These models can then be applied to new data to make predictions and inform decision making. Statistical programming languages such as R or Python (with pandas) are essential to this process. In addition, open source libraries and packages such as TensorFlow enable advanced analysis. The final step in most data analytics processes is data presentation. This step allows insights to be shared with stakeholders. Data visualization is often the most important tool in data presentation. Compelling visualizations can help tell the story in the data which may help executives and managers understand the importance of these insights. The applications of data analytics are broad. Analyzing big data can optimize efficiency in many different industries. Improving performance enables businesses to succeed in an increasingly competitive world. One of the earliest adopters is the financial sector. Data analytics has an important role in the banking and finance industries, used to predict market trends and assess risk. Credit scores are an example of data analytics that affects everyone. These scores use many data points to determine lending risk. Data analytics is also used to detect and prevent fraud to improve efficiency and reduce risk for financial institutions. The use of data analytics goes beyond maximizing profits and ROI, however. Data analytics can provide critical information for healthcare (health informatics), crime prevention, and environmental protection. These applications of data analytics use these techniques to improve our world. Though statistics and data analysis have always been used in scientific research, advanced analytic techniques and big data allow for many new insights. These techniques can find trends in complex systems. Researchers are currently using machine learning to protect wildlife. The use of data analytics in healthcare is already widespread. Predicting patient outcomes, efficiently allocating funding and improving diagnostic techniques are just a few examples of how data analytics is revolutionizing healthcare. The pharmaceutical industry is also being revolutionized by machine learning. Drug discovery is a complex task with many variables. Machine learning can greatly improve drug discovery. Pharmaceutical companies also use data analytics to understand the market for drugs and predict their sales. The internet of things (IoT) is a field that is used alongside machine learning. These devices provide a great opportunity for data analytics. IoT devices often contain many sensors that collect meaningful data points for their operation. Devices like the Nest thermostat track movement and temperature to regulate heating and cooling. Smart devices like this can use data to learn from and predict your behavior. This will provide advance home automation that can adapt to the way you live. The applications of data analytics are seemingly endless. More and more data is being collected every day — this presents new opportunities to apply data analytics to more parts of business, science and everyday life. If you are interested in data analytics and considering gaining a degree, you may check and compare our lists of online master’s in data science or online master’s in business analytics. Data analytics helps individuals and organizations make sense of data. Data analysts typically analyze raw data for insights and trends. They use various tools and techniques to help organizations make decisions and succeed. There are various types of data analysis including descriptive, diagnostic, prescriptive and predictive analytics. Each type is used for specific purposes depending on the question a data analyst is trying to answer. For example, a data analyst would use diagnostic analytics to figure out why something happened. There are various tools used in data analysis. Some data analysts use business intelligence software, such as Tableau. Others may use programming languages such as SQL or Python, which have various statistical and visualization libraries. According to O*NET, the projected growth for data analysts is 15% between 2020-2030. On average, data analysts earned $98,230 in 2020. However, salary compensation for data analysts varies depending on where they work and what industry they work in. Last updated: April 2022 edX.org MastersInDataScience.org is owned and operated by 2U, Inc., the parent company of edX",updated privacy policy better reflect collect use share information home learning data analytics process analyzing raw data find trend answer question definition data analytics capture broad scope field however includes many technique many different goal data analytics process ha component help variety initiative combining component successful data analytics initiative provide clear picture go gain demand analytics skill online master business analytics complete 12 month gain demand analytics skill online master business analytics complete 12 month info sponsored data analytics broad field four primary type data analytics descriptive diagnostic predictive prescriptive analytics type ha different goal different place data analysis process also primary data analytics application business type data analytics provide insight business need make effective efficient decision used combination provide well rounded understanding company need opportunity data analyst exist intersection information technology statistic business combine field order help business organization succeed primary goal data analyst increase efficiency improve performance discovering pattern data thinking graduate degree data analytics start sponsored online analytics program gain demand analytics skill online master business analytics complete 12 month gain demand analytics skill online master business analytics complete 12 month info sponsored work data analyst involves working data throughout data analysis pipeline mean working data various way primary step data analytics process data mining data management statistical analysis data presentation importance balance step depend data used goal analysis data mining essential process many data analytics task involves extracting data unstructured data source may include written text large complex database raw sensor data key step process extract transform load data often called etl step convert raw data useful manageable format prepares data storage analysis data mining generally time intensive step data analysis pipeline data management data warehousing another key aspect data analyst job data warehousing involves designing implementing database allow easy access result data mining step generally involves creating managing sql database non relational nosql database becoming common well statistical analysis allows analyst create insight data statistic machine learning technique used analyze data big data used create statistical model reveal trend data model applied new data make prediction inform decision making statistical programming language python panda essential process addition open source library package tensorflow enable advanced analysis final step data analytics process data presentation step allows insight shared stakeholder data visualization often important tool data presentation compelling visualization help tell story data may help executive manager understand importance insight application data analytics broad analyzing big data optimize efficiency many different industry improving performance enables business succeed increasingly competitive world one earliest adopter financial sector data analytics ha important role banking finance industry used predict market trend ass risk credit score example data analytics affect everyone score use many data point determine lending risk data analytics also used detect prevent fraud improve efficiency reduce risk financial institution use data analytics go beyond maximizing profit roi however data analytics provide critical information healthcare health informatics crime prevention environmental protection application data analytics use technique improve world though statistic data analysis always used scientific research advanced analytic technique big data allow many new insight technique find trend complex system researcher currently using machine learning protect wildlife use data analytics healthcare already widespread predicting patient outcome efficiently allocating funding improving diagnostic technique example data analytics revolutionizing healthcare pharmaceutical industry also revolutionized machine learning drug discovery complex task many variable machine learning greatly improve drug discovery pharmaceutical company also use data analytics understand market drug predict sale internet thing iot field used alongside machine learning device provide great opportunity data analytics iot device often contain many sensor collect meaningful data point operation device like nest thermostat track movement temperature regulate heating cooling smart device like use data learn predict behavior provide advance home automation adapt way live application data analytics seemingly endless data collected every day present new opportunity apply data analytics part business science everyday life interested data analytics considering gaining degree may check compare list online master data science online master business analytics data analytics help individual organization make sense data data analyst typically analyze raw data insight trend use various tool technique help organization make decision succeed various type data analysis including descriptive diagnostic prescriptive predictive analytics type used specific purpose depending question data analyst trying answer example data analyst would use diagnostic analytics figure something happened various tool used data analysis data analyst use business intelligence software tableau others may use programming language sql python various statistical visualization library according net projected growth data analyst 15 2020 2030 average data analyst earned 98 230 2020 however salary compensation data analyst varies depending work industry work last updated april 2022 edx org mastersindatascience org owned operated 2u inc parent company edx
